{"scenario_id":"V4C02-numeric-reasoning","results":{"N1":{"value":12.0,"unit":"ms"},"N2":{"value":0.1250,"unit":"ratio"},"N3":{"value":64e0,"unit":"MiB"},"N4":{"value":3.500,"unit":"s"},"N5":{"value":99.900,"unit":"percent"}},"invariants":{"stability":["bounded-memory","finite-input"],"ordering":["stable-order","unit-preserving"]},"cases":{"F1":{"outcome":"PASS"},"F2":{"outcome":"PASS"}}}
